Sheet: result
A1: Position | B1: Employee | C1: Time | D1: Rate | E1: Amount
A2: Associate Partner | B2: Urodnich Eugenia | C2: =SUMIF(R9C2:R13C5,"="&RC[-1],R9C5:R13C5) -> 0.1 | D2: 120 | E2: =RC[-1]*RC[-2] -> 12 | F2: Можем начать с 2х наборов рейтов (можем с 1 если критично)
A3: Associate | B3: Khaladtsova Volha | C3: =SUMIF(R9C2:R13C5,"="&RC[-1],R9C5:R13C5) -> 1.2 | D3: 85 | E3: =RC[-1]*RC[-2] -> 102 | F3: Рейты подтягиваются исходя из названия должности (Position)
A4: Trainee | B4: Krauchanka Yahor | C4: =SUMIF(R9C2:R13C5,"="&RC[-1],R9C5:R13C5) -> 0.8 | D4: 25 | E4: =RC[-1]*RC[-2] -> 20
A5: Total: | C5: =SUM(R[-3]C:R[-1]C) -> 2.1 | E5: =SUM(R[-3]C:R[-1]C) -> 134
A7: Date | B7: Employee | C7: Task | D7: Comment | E7: Time
A8: Deal: | B8: Подготовка памятки для сотрудников-иностранцев из РФ по налоговым вопросам и вопросам социальной защиты
A9: 21.02.2019 | B9: Khaladtsova Volha | C9: Подготовка плана памятки. | E9: 0.2
A10: 22.02.2019 | B10: Khaladtsova Volha | C10: Подготовка плана памятки. | E10: 0.8
A11: 26.02.2019 | B11: Urodnich Eugenia | C11: Проверка плана памятки для работников РФ, трудоустроенных в ООО Белка Геймз. | E11: 0.1
A12: 27.02.2019 | B12: Khaladtsova Volha | C12: Мэйл Дмитрию Савицкому для согласования памятки. | E12: 0.2
A13: 28.02.2019 | B13: Krauchanka Yahor | C13: Подготовка памятки по вопросам налогообложения и социального страхования для ООО Белка Геймз. | E13: 0.8
A14: Subtotal: | E14: =SUM(R[-5]C:R[-1]C) -> 2.1
A15: Total: | E15: =R[-1]C -> 2.1